{
  "schema_version": "1.0.0",
  "skill": "midweek",
  "client_id": "acme-demo",
  "quarter_id": "2026-Q1",
  "generated_at": "2026-01-20T09:20:00Z",
  "status": "success",
  "week_of": {
    "from": "2026-01-19",
    "to": "2026-01-25"
  },
  "planned_this_week": [
    {
      "task_id": "t-88089e96033baf68",
      "title": "Configurar pixel de conversao no site",
      "due_at": "2026-01-23",
      "status": "pending"
    }
  ],
  "completed": [
    {
      "task_id": "acme-demo-task-002",
      "title": "[dado sintético] Publicar criativo de vídeo de lançamento",
      "due_at": "2026-01-10",
      "status": "completed"
    }
  ],
  "pending": [
    {
      "task_id": "t-88089e96033baf68",
      "title": "Configurar pixel de conversao no site",
      "due_at": "2026-01-23",
      "status": "pending"
    }
  ],
  "overdue": [],
  "blocked": [],
  "changed_evidence_or_results": [],
  "risks": [],
  "actions_needing_decision": [
    {
      "statement": "Decidir budget de Meta Ads de fevereiro/2026",
      "source": "task-proposals.json:acme-demo-tp-003"
    }
  ],
  "missing_data": [],
  "warnings": [
    "changed_evidence_or_results vazio — apenas uma execucao de build-context-pack existe ate agora, sem execucao anterior para comparar."
  ]
}
